toni anker tenang jamet tiktok,Fitnah
toni perintah enak an kena warga ngga sekali kena bpk ,Fitnah
toni kadang omong beda ngomong tindak solusi,Fitnah
toni kau arang cerita,Fitnah
toni sengaja transisi biar denda masuk uang bisa masuk kantong bos ,Fitnah
bisnis selubung uang masuk saku toni ,Fitnah
bukti tanggung jawab toni tidak jalan ,Fitnah
solusi buat kerja toni mikirin lu ga mikirin ,Fitnah
toni kagak becus kerja ,Fitnah
toni tidak dispilin urus dki jakarta ,Fitnah
masuk bisokop rapit tes dana buat toni,Fitnah
toni kagak sekolah bodoh pelihara ,Fitnah
toni jakarta tukang bohong ,Fitnah
toni nolong meres ,Fitnah
salah toni tanggung jawab lu gara lu gelar formula tular covid,Fitnah
salah toni dukung napi cocol,Fitnah
kampanye toni solatin orang tinggal bacot dasar parah banget ,Fitnah
data dki ama nasional beda cari panggung please toni,Fitnah
jakarta toni santai,Fitnah
makan uang pajak rakyat toni,Fitnah
budi putra toni ngambil hak rakyat mulu ,Fitnah
nelen uang denda covid toni bahaya ntar perut kembung ,Fitnah
jakarta toni buruk lepas tanggung jawab ,Fitnah
update corona toni tidak tanggung jawab ,Fitnah
heran sama negara putra ga keliahatan kerja ,Fitnah
duit tilep ngapain publish mending diem biar masuk kantong toni,Fitnah
covid jadi ajang bisnis putri pesta pakai uang hak rakyat ,Fitnah
suka canda kerja ga tanggung jawab becandain putri ,Fitnah
putri ngapain jabat menkes kerja bacain data doang sama ngambil hak rakyat ,Fitnah
bisa ganti nama ga sanggup undur mending putri kasi rakyat derita ,Fitnah
lo beloon putri,Fitnah
putri kerja engkang kaki doang bro ,Fitnah
putri kagak kerja,Fitnah
ga ngotak putri gede dijadiin canda,Fitnah
lu tutup putri,Fitnah
julia abis minjem hutang ngutang mulu kerja lu ,Fitnah
catetan nota bon duit masuk kantong julia bos ,Fitnah
tugas julia berfikir bangun ekonomi indonesia utang mulu ngutang duit hati hati sadar uang dipake penting pribadi,Fitnah
moral kerja ga tanggung jawab julia,Fitnah
covid budi mimpin indonesia hancur emang julia ga becus ,Fitnah
otak jabat otak bisnis julia ngutang mulu sri uang negara dipake pribadi ,Fitnah
bacot lu julia,Fitnah
ujung ujung hutang lama lu julia ngejabat indo hutang ,Fitnah
mending turun julia gaada manfaat lu jadi pemimpin,Fitnah
suruh turun akibat negara banyak hutang gara gara lu julia,Fitnah
bodoh pelihara julia pinter dikit ,Fitnah
bukti masuk virus sebar januari budi upaya tangkal sebar sampah jebol ,Fitnah
budi tangkal tutup corona ,Fitnah
budi ambil uang rakyat indo ,Fitnah
budi penting duit,Fitnah
nama regulasi atur wisatawan gara wisatawan budi ga peduli,Fitnah
budi santai gilir kena orang indonesia kejar orang jual masker buat pidana hukum ,Fitnah
budi wisatawan negara tular bolehin masuk gilir kelimpungan cegah negara tetangga,Fitnah
uang negara pakai butuh pribadi sama budi negara hancur ,Fitnah
indonesia duit gas budi mimpin ,Fitnah
rangka sukses tekan tumbuh penduduk budi rakyat biar mati impor ,Fitnah
budi dablek sakit periksa pake masker ,Fitnah
budi lambat tindak antisipasi alih perintah kekeuh indonesia negatif corona ,Fitnah
parah emang budi takabur ampe sepele ,Fitnah
emang banget budi santai ijin akses wna masuk indo ,Fitnah
keluarga budi knpa gaada kena main budi doang biar uang ,Fitnah
settingan budi doang takut ,Fitnah
budi kagak kerja lu kabar indo ,Fitnah
corona main jokowi ga biar uang who bener ga budi,Fitnah
akibat budi santai,Fitnah
ayo warga china masuk indonesia budi izin masuk negara,Fitnah
heran kemari curiga putri sama budi alih isu korupsi heloo perintah kabar korupsi,Fitnah
budi mikirin untung yaudah pusing ,Fitnah
negara payah sebenernya budi perintah anggota ga becus santai,Fitnah
budi lambat perintah jatuh korban warga indonesia tidak harga mata pimpin negara ,Fitnah
budi santai kalang kabut negara,Fitnah
bener bukti perintah budi sepele,Fitnah
bodoh budi negara promosi orang asing masuk,Fitnah
bohong budi putri toni hadap rakyat akibat negara maju tolak warga negara asing virus corona indonesia,Fitnah
bantu rakyat ga turun turun sembunyi pimpin budi,Fitnah
budi nurut mulu sama sultan,Fitnah
capek bodoh indonesia kau buat jadi bodoh budi,Fitnah
budi kagak kerja,Fitnah
budi sama negara hutang rakyat ga hobby ngutang,Fitnah
budi utang mulu ngutang mulu indonesia ambil alih ganti nama indomearet ,Fitnah
gausah mikirin dunia negeri urusin budi leha leha mulu kerjaanya ,Fitnah
subsidi butuh bicara petinggi budi bosan omong mu ,Fitnah
ayuk bongkar pandemi psbb elit global main main budi cinta sama kawan,Fitnah
nyari duit banget heran segitu naikin ekonomi negara lu budi ga mikir ,Fitnah
enak jadi orang petinggi budi salah tinggal bantah buat salah tinggal konfirmasi dimaafin ,Fitnah
dasar kang tilep hak gaji orang lu budi tikus curut ,Fitnah
terima kasih buat budi warga impor nyata virus impor tolol perintah dongok ,Fitnah
ngomong budi jadi ga percaya tukang bohong ,Fitnah
budi pasang target ga masuk akal ngucap ralat sama ,Fitnah
bener budi omongin beda ama realisasi dasar tanda tanda munafik ,Fitnah
lama janji janji doang ujung ujung php lu budi,Fitnah
tukang bohong lu budi,Fitnah
bohong mulu hiduplu budi ga capek ga takut tanggung jawab akhirat ,Fitnah
budi tidak punya komitmen bagus negara amburadul,Fitnah
masyarakat hidup normal data ngga normal normal budi otak ngga normal ,Fitnah
uang uang cari uang budi nyari uang derita rakyat ,Fitnah
sakit jadi bisnis duit hutang negara gara gara budi cinta ,Fitnah
usaha selamat warga vaksin kasih harga duit ujung budi peras uang rakyat ,Fitnah
cfd buka mall buka masjid ngga budi kafir ,Fitnah
vaksin uang uang budi ngga tanggung jawab ,Fitnah
bodoh lu budi budak cina ,Fitnah
budi halu lu jadi kacung sultan,Fitnah
cabut new normal jadi budi tidak konsisten tidak komitmen ,Fitnah
budi jadi pandemi ajang bisnis ,Fitnah
corono akal bulus budi kawan kawan ,Fitnah
mau kondusif demo biar new normal atur tindak budi yamg ngelanggar tolol emang ,Fitnah
budi bodoh sama negara lu jadi pemimpin,Fitnah
informasi covid tidak transparan putri budi tutup jadi ajang bisnis ,Fitnah
budi negara usaha kontrol angka indo buka bioskop nambah ntar ga punya otak budi,Fitnah
bodoh bioskop buka ngga sekolah budi ga ngotak ,Fitnah
rakyat indonesia pintar pimpin lo bodoh budi,Fitnah
anggar habis bisnis buka urus duit budi nomor tidak ,Fitnah
tingkat main budi biar bayar,Fitnah
kasih izin deme demo izinin budi emang banget rusuh ,Fitnah
curiga dana covid digunain penting pribadi budi,Fitnah
covid jadi ajang budi cari uang,Fitnah
bisnis urus uang masuk bayar hutang negara budi ga punya malu ,Fitnah
presiden lu gausah ngurusin bioskop lu urusin warga barbar lupa budi barbar ,Fitnah
budi putra ga kerja ,Fitnah
bukti transparan covid tutup budi ga kerja,Fitnah
pandemi akal budi,Fitnah
budi jadi budak negara bodoh,Fitnah
budi tidak punya malu hutang negara tingkat,Fitnah
duit covid alir deras kantong budi jahat enak uang gaji bulan,Fitnah
bodoh curi lu budi curi hak orang ,Fitnah
budi lambat tindak antisipasi alih perintah kekeuh indonesia negatif corona ,Fitnah
indonesia rakyat mati budi santai bos ,Fitnah
budi lepas tangan ,Fitnah
goblok emang budi astaga ,Fitnah
budi lamban banget dibilangin covid anggap remeh ,Fitnah
budi petinggi ga punya otak ,Fitnah
emang aneh bang budi hati ramah lembut rendah hati jadi larang wisatawan masuk aneh bisa bobol ,Fitnah
dablek perintah budi pimpin dablek,Fitnah
budi lamban banget ,Fitnah
budi tidur enak bro makan uang rakyat,Fitnah
budi gerak lama,Fitnah
ngigo lu yak budi kemaren kaga sembako lu makan kali ,Fitnah
ekonomi negara hancur pade budi gagal mimpin ngotot periode hancur ,Fitnah
negara kaya raya budi negara miskin ngemis nyari pinjam ga malu lu ,Fitnah
bacot lu budi bukti ga tanggung jawab dasar ,Fitnah
bodo lu produksi kaga percaya budi tukang bohong,Fitnah
budi kagak kerja,Fitnah
janji laksana budi suka bohong ,Fitnah
budi ciri orang munafik janji ingkar ,Fitnah
bacot produksi budi bacot doang aksi ngga ,Fitnah
mending mundur budi ngga tanggung jawab lu ,Fitnah
budi sandiwara negara ga lu urus ,Fitnah
sakit jadi bisnis banget ekonomi indonesia ga bener budi mimpin amburadul ,Fitnah
ga gratisin masyarakat sehat dikit denda uang denda masuk kantong budi,Fitnah
percaya virus tidak percaya media data covid budi suka bohong ,Fitnah
covid jadi becandaan budi jadi boneka partai bodoh banget ,Fitnah
tolong budi jadi tukang php janji tidak bertanggung jawab ,Fitnah
lu budi tidak konsisten ,Fitnah
ga peduli sama corona budi kagak peduli putra gaada tanggung jawab curi hak rakyat,Fitnah
dengar dengar uang denda masuk kantong budi,Fitnah
bioskop buka corona tingkat demo dibolehin gila lo budi,Fitnah
budi tukang php,Fitnah
bisnis covid jadi alas bayar hutang negara budi ga ngotak,Fitnah
budi bacot bukti ,Fitnah
budi bacot omdo ,Fitnah
komentar negatif gamau turun turun lu budi ga jadi pemimpin,Fitnah
budi insentif prakerja turun masuk saku,Fitnah
putra tukang bohong ,Fitnah
putra ngapain lu jadi wakil numpang tenar lu yak mending tidur rumah gausah sok jadi wakil budi,Fitnah
putra nyepam doang lu kerja kagak gaji enak bener hidup lu akhirat,Fitnah
ngga akhlak lu putra,Fitnah
putra lu jadi wakil budi cari tenar lu ,Fitnah
putra tidak sama sekali kerja lu ngopi baca koran negara kacau ,Fitnah
putra makan gaji buta kerja kagak gaji ,Fitnah
covid putra ga kerja ,Fitnah
putra bener bener gaji buta ,Fitnah
putra ga tanggung jawab lama ngapain ,Fitnah
makan gaji buta mulu lu putra,Fitnah
putra korup lu ,Fitnah
putra ga keliahatan kerja ,Fitnah
putra tidak bawa dampak indonesia ,Fitnah
beneran nanya putra ngapain makan gaji buta lu ,Fitnah
bodo ga peduli putra gaada wujud banget korupsi ,Fitnah
putra bener makan gaji ga halal ,Fitnah
putra jancuk ngga kerja gaji masuk ,Fitnah
budi saking gantung sama pemasukan negara ambil resiko nutup akses negara asa dampak positif kena mahal susah cari utang dibanyakin pajak masyarakat dinaikin,Fitnah
bener budi takut hilang retjeh cibu,Fitnah
bener budi klemer duit mulu dipikirin rakyat bengkalai dibiarin ,Fitnah
budi biar kena corona perintah curang ngga mikir ,Fitnah
rekam jejak pasien cek budi lamban jalan perintah indo,Fitnah
julia ga becus ,Fitnah
bohong mulu hidup lu julia,Fitnah
hutang gara gara lu jabat julia,Fitnah
mundur julia ga becus ,Fitnah
julia goblok banget ,Fitnah
paksa bloon memikirkam ga penting lu bloon putri,Fitnah
lu emang kgk kerja putri gila sempet ngurusin urus sepele ganti istilah ,Fitnah
nama diurusin lu urusin kerja lu putri suka numpuk doang,Fitnah
kerjan lu putri gonta ganti nama ,Fitnah
putri dasar curi curi uang rakyat ,Fitnah
toni nyebarin isu corona binatang ,Fitnah
toni lamban ,Fitnah
toni barbar sekatekate ,Fitnah
toni buka akses negeri orng negeri masuk negara kena virus corona,Fitnah
toni diam bisa lolos bandara pakai jaket tebal gajelas bandara bisa msk indonesia ,Fitnah
sekolah libur mall hibur buka sumpah,Nonfitnah
bingung negara,Nonfitnah
budi sama toni kena buka wisatawan indonesia ,Nonfitnah
lucu budi bilang bubar lu bilang dibubarin ,Nonfitnah
makan hak julia,Nonfitnah
santai budi tenang bom ,Nonfitnah
numpang ketawa,Nonfitnah
ribet,Nonfitnah
cerita ngarang ,Nonfitnah
solusi,Nonfitnah
kali jabat jadi budi buruk merosot ,Nonfitnah
putra sehat ,Nonfitnah
putra kabar ,Nonfitnah
wakil negara ,Nonfitnah
toni capek capek ,Nonfitnah
toni naek covidnya paham ekonomi penting coba cegah sebar ,Nonfitnah
toni nongol ,Nonfitnah
toni tdnya tinggal lebaran lonjak pasca lebaran ,Nonfitnah
ubah toni entar kompak umuminnya ,Nonfitnah
oh ya,Nonfitnah
anjeng ngeri ,Nonfitnah
main toni,Nonfitnah
penting cuan rakyat normal maksa denda ,Nonfitnah
awas diboongin china luh ,Nonfitnah
ladang bisnis terus duit terus,Nonfitnah
wacana doang ,Nonfitnah
korona bisnis club ,Nonfitnah
dengerin suka ga mudeng plis sistem tatap muka efektif ,Nonfitnah
bodo omong lo bukti ,Nonfitnah
lama keburu modar orang ,Nonfitnah
butuh bukti wacana ,Nonfitnah
gerasain pimpin beliau ending,Nonfitnah
mantap budi,Nonfitnah
kartu prakerja jalan ga ,Nonfitnah
kelar ,Nonfitnah
enuh info ,Nonfitnah
hebat gamau vaksin,Nonfitnah
bang jago ,Nonfitnah
ragu nyampein budi,Nonfitnah
kemarim bilang ,Nonfitnah
lama ,Nonfitnah
prediksi ,Nonfitnah
budi sabar banget ,Nonfitnah
iya banyakin rencana ya,Nonfitnah
cepat selesai moga ,Nonfitnah
waspada budi negara kita,Nonfitnah
sadar nggak ventilator nggak sadar maaf ,Nonfitnah
new normal sama ga konsisten banget jadi orang ,Nonfitnah
bagus bioskop buka timbang dampak kondisi buat kena tolong budi perhati nyengir foto ,Nonfitnah
lucu buka seat krl penuh dempet dempet bioskop tonton batas ga sumpek kaya krl jam pulang kerja ,Nonfitnah
gila kali pasar lu pade tutup,Nonfitnah
penting kaga ngapain buka ohiye orang jakarte kage percaya corona ,Nonfitnah
mall tutup sekali bioskop doang,Nonfitnah
bantu sembako tidak rakyat jabat ,Nonfitnah
bilang larang ngelawan ,Nonfitnah
bodo amat,Nonfitnah
biar emang ngaruh orang susah ,Nonfitnah
lo nis,Nonfitnah
pak budi mohon perhati sektor bisnis hotel kerja sektor hotel gantung bijak ,Nonfitnah
kena phk ,Nonfitnah
inti suruh nganggur ,Nonfitnah
mulu bosen ,Nonfitnah
bubur merah putih ,Nonfitnah
bosen bngt ,Nonfitnah
zonk ga manfaat ganti istilah ,Nonfitnah
geblek ,Nonfitnah
lu gonta ganti faedah bosquh ,Nonfitnah
tele tele ,Nonfitnah
cari ,Nonfitnah
perintah zodiak libra ubah ubah mulu ,Nonfitnah
manfaat ubah nama rubah pasien covid positif bisa ga ,Nonfitnah
jadi ngurusin ubah istilah ,Nonfitnah
tuju biar manfaat ganti,Nonfitnah
paksa bloon memikirkam ga penting ,Nonfitnah
ganti nama biar keren dikit jancuk ,Nonfitnah
pakai masker kemarin lupa,Nonfitnah
bodo ,Nonfitnah
pusing kasih duet napa ,Nonfitnah
coba jajar ganti pengaruh ,Nonfitnah
so pinter lu ,Nonfitnah
hasil ,Nonfitnah
sakit ribet,Nonfitnah
ganti nama biar buang sial ,Nonfitnah
serah lu ,Nonfitnah
takut pecat biar kerja ,Nonfitnah
sekarepmu ,Nonfitnah
revisi mulu sidang ,Nonfitnah
manfaat emng ganti ,Nonfitnah
merdeka laaa ,Nonfitnah
ga penting ,Nonfitnah
atur bos ,Nonfitnah
dagel putri ganti nama mulu bentar covid ganti nama ,Nonfitnah
gamau bubar ganti nama biar gaji kerja ngga halal lu gus ,Nonfitnah
maret ampe skrang nama sembako bansos gua nggak turun,Nonfitnah
percaya mantan penjara gara gagalin pandemik flu burung bicara beliau ngga bantu track record takjub ,Nonfitnah
orang dablek sakit periksa pake masker ,Nonfitnah
habis vaksin edar munculah vaksin palsu ,Nonfitnah
amburadul indonesia bubar beneran ,Nonfitnah
rese ga rese ,Nonfitnah
utang ,Nonfitnah
tri uang bos online jadi ,Nonfitnah
indonesia masuk negara maju ,Nonfitnah
ratu utang ,Nonfitnah
utang utang utang mundur julia,Nonfitnah
duit kantong tu duit ,Nonfitnah
ibuk suka ngutang warung imf ,Nonfitnah
mantep jeng ,Nonfitnah
triliun kemanain ,Nonfitnah
tampang lelah ,Nonfitnah
lama kali ,Nonfitnah
lu mencle mencle ngomongnya ,Nonfitnah
rindu triliyun ,Nonfitnah
kerja kerja duit dipake korupsi coba julia partai korup beku partai ,Nonfitnah
idup lu,Nonfitnah
gmn ga kacau ekonomi jabat kena ott kpk ,Nonfitnah
jadi pandemi bisnis kog harga ,Nonfitnah
ujung meres rakyat ,Nonfitnah
roket ,Nonfitnah
bahaya diduitin orang susah manfaat perintah suluh denda ,Nonfitnah
rb triliun manaa ,Nonfitnah
utang kaya tidak percaya ,Nonfitnah
mantep jeng ,Nonfitnah
jadi konspirasi ga ,Nonfitnah
keburu telat ,Nonfitnah
lama ga bisa cepat rindu hidup normal ,Nonfitnah
ken ketawa takut dosa ,Nonfitnah
keburu ,Nonfitnah
nyawa keburu bnyak makan januari ,Nonfitnah
konspirasi ,Nonfitnah
dasar lu malih ,Nonfitnah
serah de aja ,Nonfitnah
yaudehhh iyedahhhh serah pakde ,Nonfitnah
perintah gerak support ,Nonfitnah
suka kau ,Nonfitnah
keburu cepirit ,Nonfitnah
jadi sen pake mecin ,Nonfitnah
ngomong mending tidur ,Nonfitnah
lumayan lama ,Nonfitnah
mampaatin momen lu buat korupsi pantes budi marah kemaren uang sumbang,Nonfitnah
diam budi janji mulu,Nonfitnah
akibat orang asing perintah budi,Nonfitnah
dirumah aja sama mati lapar tolol bet ,Nonfitnah
serah lw njing,Nonfitnah
bacot lu pemimpin ,Nonfitnah
bicara burung beo bisa,Nonfitnah
budi kerjasama sama rakyat coba ajak kerjasama ,Nonfitnah
perintah korupsi jujur ga,Nonfitnah
mall buka kerumun orang masjid ibadah bolehin aneh budi,Nonfitnah
duit duit lu peres rakyat biar mati susah ,Nonfitnah
duit masuk kantong tuh,Nonfitnah
duit kemanain yak perintah tidak transparan rakyat ,Nonfitnah
duit buat kaum perintah budi die orang ngajuin olah lo orang kasi denger ,Nonfitnah
emang banget santai ijinin akses wna masuk indo ,Nonfitnah
budi putra wakil rakyat jela hina budi,Nonfitnah
gua bingung sama koruptor korupsi punya rumah mewah mobil mewah makan uang negara,Nonfitnah
rangka sukses tekan tumbuh duduk budi rakyat biar mati impor ,Nonfitnah
asli ga takut main ,Nonfitnah
perintah indonesia kacau ,Nonfitnah
borong sama budi ,Nonfitnah
php in terus,Nonfitnah
bodoh who perintah perlahan hancur ekonomi negara beli obat ,Nonfitnah
takut gausah ngasih harap kena netizen ,Nonfitnah
panjangin psbb fase heboh berita corona biar tutup rakyat ancur sekali masuk enak perintah nikmat kucur dana ,Nonfitnah
ga nyangka lama pakai masker sama dukung bisnis orang rancang good job indonesia merdeka ,Nonfitnah
masuk bioskop surat sakti presiden terang sehat corona alias kudu rapid test mafia sorak peluang ,Nonfitnah
negara tutup sekali susah mampir besok buka jam puluh ,Nonfitnah
insentif prakerja hadooohh ,Nonfitnah
bomat ga peduli ,Nonfitnah
yo ayo bayar listrik buat negara devfisit ayo ayo,Nonfitnah
oke ,Nonfitnah
kiai ga ,Nonfitnah
putra ga ,Nonfitnah
serah lu ,Nonfitnah
atur suka ubah ubah salam ,Nonfitnah
psbb ngk bosen ,Nonfitnah
tugas ,Nonfitnah
maksud pantang mundur ,Nonfitnah
ga wujud ,Nonfitnah
habis lantik ga ,Nonfitnah
ga muncul ,Nonfitnah
bantu rumah budi,Nonfitnah
manfaat ubah,Nonfitnah
covid babak belur,Nonfitnah
mending produksi duit,Nonfitnah
ga cape sandiwara ,Nonfitnah
sakit jiwa ,Nonfitnah
rubah buat apaansii pusing kudu istilah hadeh ,Nonfitnah
hasil ubah ,Nonfitnah
awan gamau mundur ,Nonfitnah
tu orang nongol mulu ,Nonfitnah
suka suka lu ,Nonfitnah
ketawa takut penjara ,Nonfitnah
busa ,Nonfitnah
katawa,Nonfitnah
nggak lama sekolah tutup ,Nonfitnah
jual masker duit mulu,Nonfitnah
takut sama cina ,Nonfitnah
bijak amburadul ,Nonfitnah
alah hoak,Nonfitnah
panggung bro ,Nonfitnah
